{
  "agent_identity": {
    "adapter_type": "codex_cli",
    "framework": "codex-cli-0.158.0",
    "model_id": "gpt-6-sol",
    "model_version": null,
    "provider": "openai",
    "scaffold_id": "neutral_optics_v1",
    "system_prompt_version": "neutral_optics_v1"
  },
  "attempt_count": 1,
  "cost": null,
  "execution_class": "real",
  "failure_class": null,
  "first_attempt_success": true,
  "model_turn_count": 1,
  "parsed_answer": {
    "answers": {
      "q1": {
        "angle_change": {
          "unit": "deg",
          "value": 1.0
        }
      },
      "q2": {
        "spot_displacement": {
          "unit": "mm",
          "value": 34.9
        }
      },
      "q3": {
        "geometry_change": {
          "held_fixed": "mirror_rotation",
          "scale": {
            "unit": "1",
            "value": 0.25
          },
          "variable": "screen_distance"
        }
      }
    },
    "explanation": "The reflected beam turns through twice the mirror rotation. Its spot moves approximately 2.0 m × tan(1.0°) = 34.9 mm. At fixed mirror rotation, displacement scales with screen distance."
  },
  "protocol": {
    "id": "closed_book",
    "scientific_payload_sha256": "6ee1637585d38ceb6b2688479645b70fc20f4c9251186aae7e6cd0a9e1c02371",
    "version": "1.0.0"
  },
  "protocol_compliance_verified": true,
  "raw_response": "{\"answers\":{\"q1\":{\"angle_change\":{\"value\":1.0,\"unit\":\"deg\"}},\"q2\":{\"spot_displacement\":{\"value\":34.9,\"unit\":\"mm\"}},\"q3\":{\"geometry_change\":{\"variable\":\"screen_distance\",\"held_fixed\":\"mirror_rotation\",\"scale\":{\"value\":0.25,\"unit\":\"1\"}}}},\"explanation\":\"The reflected beam turns through twice the mirror rotation. Its spot moves approximately 2.0 m × tan(1.0°) = 34.9 mm. At fixed mirror rotation, displacement scales with screen distance.\"}",
  "retrieval": null,
  "retry_count": 0,
  "run_id": "2026-09-28-openai-gpt-6-sol-020rc1-formal",
  "run_record_version": "0.1.0",
  "runner_source_revision": "caebd4bbb908a6a2e9b375b0de5f3ccec759a57d+source-sha256:7ef29715ea6a705dc9ca41d4760b9953cf899b5d97a06ab92297d61926931cba",
  "score_result": {
    "benchmark_version": "0.2.0-rc1",
    "case_content_sha256": "dd9acbee1590f341e4262b1a75be2d40a37d139f7917dff5c9b5d6dcde1fa835",
    "case_id": "SEED-1-1",
    "case_library_access": {
      "available": false,
      "retrieved_document_ids": [],
      "snapshot_id": null
    },
    "case_revision": "0.1.5",
    "cost": null,
    "criterion_scores": [
      {
        "criterion_id": "n_angle",
        "evidence": "Absolute SI error 0 <= inclusive tolerance 0.000349065850399.",
        "score": 1,
        "status": "scored",
        "weight": 0.3
      },
      {
        "criterion_id": "n_shift",
        "evidence": "Absolute SI error 1.01298564352e-05 <= inclusive tolerance 0.001.",
        "score": 1,
        "status": "scored",
        "weight": 0.4
      },
      {
        "criterion_id": "c_quarter",
        "evidence": "predicted screen-shift ratio 0.25 vs 0.25",
        "score": 1,
        "status": "scored",
        "weight": 0.3
      }
    ],
    "evaluator_fingerprint": "f98d459b6742e0bc992f2db2ac9d94cf81507e0d8380cd7bed4ea830e1454382",
    "evaluator_version": "0.2.0",
    "failure_mode": "none",
    "judge_results": [],
    "protocol": "closed_book",
    "provider_usage": {
      "turns": [
        {
          "source": "codex_jsonl",
          "usage": {
            "cached_input": 0,
            "input": 12742,
            "output": 170,
            "reasoning": 46
          }
        }
      ]
    },
    "raw_answer": "{\"answers\":{\"q1\":{\"angle_change\":{\"value\":1.0,\"unit\":\"deg\"}},\"q2\":{\"spot_displacement\":{\"value\":34.9,\"unit\":\"mm\"}},\"q3\":{\"geometry_change\":{\"variable\":\"screen_distance\",\"held_fixed\":\"mirror_rotation\",\"scale\":{\"value\":0.25,\"unit\":\"1\"}}}},\"explanation\":\"The reflected beam turns through twice the mirror rotation. Its spot moves approximately 2.0 m × tan(1.0°) = 34.9 mm. At fixed mirror rotation, displacement scales with screen distance.\"}",
    "result_schema_version": "0.1.0",
    "retry_count": 0,
    "run_id": "2026-09-28-openai-gpt-6-sol-020rc1-formal",
    "scores": {
      "capped_total": 1.0,
      "raw_total": 1.0
    },
    "structured_answer": {
      "answers": {
        "q1": {
          "angle_change": {
            "unit": "deg",
            "value": 1.0
          }
        },
        "q2": {
          "spot_displacement": {
            "unit": "mm",
            "value": 34.9
          }
        },
        "q3": {
          "geometry_change": {
            "held_fixed": "mirror_rotation",
            "scale": {
              "unit": "1",
              "value": 0.25
            },
            "variable": "screen_distance"
          }
        }
      },
      "explanation": "The reflected beam turns through twice the mirror rotation. Its spot moves approximately 2.0 m × tan(1.0°) = 34.9 mm. At fixed mirror rotation, displacement scales with screen distance."
    },
    "system": {
      "model_id": "gpt-6-sol",
      "model_version": null,
      "name": "codex-cli-0.158.0",
      "provider": "openai",
      "scaffold_id": "neutral_optics_v1"
    },
    "tokens": {
      "cached_input": 0,
      "input": 12742,
      "output": 170,
      "total": 12912
    },
    "tool_call_count": 0,
    "tools_available": [],
    "tools_used": [],
    "validator_results": [
      {
        "check_id": "n_angle",
        "details": {
          "answer_path": "answers.q1.angle_change",
          "candidate_si": 0.017453292519943295,
          "comparator": "max_abs_or_relative_inclusive",
          "difference_si": 0.0,
          "dimension": "angle",
          "magnitude_convention": true,
          "tolerance_si": 0.00034906585039886593,
          "validator_id": "mirror_angle"
        },
        "evidence": "Absolute SI error 0 <= inclusive tolerance 0.000349065850399.",
        "score": 1,
        "status": "pass",
        "version": "0.2.0"
      },
      {
        "check_id": "n_shift",
        "details": {
          "answer_path": "answers.q2.spot_displacement",
          "candidate_si": 0.0349,
          "comparator": "max_abs_or_relative_inclusive",
          "difference_si": -1.0129856435170392e-05,
          "dimension": "length",
          "magnitude_convention": true,
          "tolerance_si": 0.001,
          "validator_id": "mirror_spot_shift"
        },
        "evidence": "Absolute SI error 1.01298564352e-05 <= inclusive tolerance 0.001.",
        "score": 1,
        "status": "pass",
        "version": "0.2.0"
      },
      {
        "check_id": "c_quarter",
        "details": {
          "predicted_ratio": 0.25,
          "tolerance": 0.005
        },
        "evidence": "predicted screen-shift ratio 0.25 vs 0.25",
        "score": 1,
        "status": "pass",
        "version": "mirror_geometry_v0.1"
      }
    ],
    "wall_time_seconds": 12.375
  },
  "selection": {
    "case_content_sha256": "dd9acbee1590f341e4262b1a75be2d40a37d139f7917dff5c9b5d6dcde1fa835",
    "case_id": "SEED-1-1",
    "case_revision": "0.1.5",
    "track": "verified",
    "variant_id": null,
    "variant_type": null
  },
  "status": "completed",
  "tool_calls": [],
  "tool_observation_scope": "complete_with_builtin_tools_disabled",
  "usage": {
    "cached_input": 0,
    "input": 12742,
    "output": 170,
    "reasoning": 46,
    "total": 12912
  },
  "wall_time_seconds": 12.453000000037719
}
