{
  "agent_identity": {
    "adapter_type": "codex_cli",
    "framework": "codex-cli-0.158.0",
    "model_id": "gpt-6-luna",
    "model_version": null,
    "provider": "openai",
    "scaffold_id": "neutral_optics_v1",
    "system_prompt_version": "neutral_optics_v1"
  },
  "attempt_count": 1,
  "cost": null,
  "execution_class": "real",
  "failure_class": "invalid_contract",
  "first_attempt_success": false,
  "model_turn_count": 1,
  "parsed_answer": {
    "answers": {
      "q1": {
        "image_distance_in_focal_lengths": {
          "unit": "f",
          "value": 2
        }
      },
      "q2": {
        "lateral_magnification": {
          "unit": "1",
          "value": -1
        }
      },
      "q3": {
        "image_type": "real",
        "orientation": "inverted"
      }
    }
  },
  "protocol": {
    "id": "case_assisted",
    "scientific_payload_sha256": "c6594b75be6d42473fb95d83357fd89fc6b02cf71ceaf6ce153a0192477ee7eb",
    "version": "1.0.0"
  },
  "protocol_compliance_verified": true,
  "raw_response": "{\n  \"answers\": {\n    \"q1\": {\n      \"image_distance_in_focal_lengths\": {\n        \"value\": 2,\n        \"unit\": \"f\"\n      }\n    },\n    \"q2\": {\n      \"lateral_magnification\": {\n        \"value\": -1,\n        \"unit\": \"1\"\n      }\n    },\n    \"q3\": {\n      \"image_type\": \"real\",\n      \"orientation\": \"inverted\"\n    }\n  }\n}",
  "retrieval": {
    "item_count": 2,
    "items": [
      {
        "content_sha256": "7163af8d9aacdca5116e780a8b2cf9d272826ec5a7777ce450293ee904abbe6a",
        "estimated_tokens": 69,
        "item_id": "EX-PINHOLE-01",
        "score": 2.34720039,
        "text": "# Spatial-filter alignment failure\n\nWhen a focused free-space beam misses a spatial-filter pinhole, first reduce\npower, place a viewing card at the focus, and adjust transverse pinhole position\nwith small steps. Distinguish clipping from a focus displaced along the optical\naxis: transverse motion changes the bright spot overlap, whereas axial motion\nchanges the spot size at the aperture. Do not infer that every low-throughput\ncondition calls for a smaller aperture.\n"
      },
      {
        "content_sha256": "35719a025fc1ec9a9da538d1bbf0f81aaa57d2e22f66bf18a2bc02f513d1a3e3",
        "estimated_tokens": 76,
        "item_id": "EX-DETECT-01",
        "score": 1.38629436,
        "text": "# Detector linearity calibration\n\nTo test whether a photodiode response is linear, attenuate a stable free-space\nbeam with calibrated neutral-density filters and record dark-subtracted output.\nFor an illustrative filter transmitting 12% of incident power, a linear response\nshould fall to about 12% of its previous dark-subtracted reading. If the ratio\nchanges with incident power, inspect amplifier saturation, offset, and detector\nbandwidth before interpreting the optical signal.\n\nRecord the filter transmission and dark offsets in the measurement log.\n"
      }
    ],
    "latency_seconds": 0.00573079998139292,
    "library_index_sha256": "99d374539ac143d3dd1fc44a532a34f5f0d6e0b20af2291c7692179cdb497003",
    "library_snapshot_id": "optics-examples-v1",
    "query": "An object is placed at a distance 2f in front of an ideal positive thin lens of focal length f. Where is the image formed? Express its distance behind the lens in units of f. What is the signed transverse magnification? Is the image real or virtual, upright or inverted?",
    "query_sha256": "6975efa1ed479902593e2bf4672a0e534fcf246dad7f23121ce79193a5da4248",
    "retrieval_version": "lexical_v1.0.0",
    "retrieved_ids": [
      "EX-PINHOLE-01",
      "EX-DETECT-01"
    ],
    "scores": [
      2.34720039,
      1.38629436
    ],
    "total_retrieved_tokens": 145
  },
  "retry_count": 0,
  "run_id": "2026-09-28-openai-gpt-6-luna-020rc1-formal",
  "run_record_version": "0.1.0",
  "runner_source_revision": "caebd4bbb908a6a2e9b375b0de5f3ccec759a57d+source-sha256:7ef29715ea6a705dc9ca41d4760b9953cf899b5d97a06ab92297d61926931cba",
  "score_result": {
    "benchmark_version": "0.2.0-rc1",
    "case_content_sha256": "ede169b7b694734d54d7502f5cb8c08a58aa26c0cb5f46167ae01e50186e25ea",
    "case_id": "SEED-3-1",
    "case_library_access": {
      "available": true,
      "retrieved_document_ids": [
        "EX-PINHOLE-01",
        "EX-DETECT-01"
      ],
      "snapshot_id": "optics-examples-v1"
    },
    "case_revision": "0.3.0",
    "cost": null,
    "criterion_scores": [
      {
        "criterion_id": "n_image_distance",
        "evidence": "unsupported unit: 'f'",
        "score": 0,
        "status": "scored",
        "weight": 0.4
      },
      {
        "criterion_id": "n_magnification",
        "evidence": "Absolute SI error 0 <= inclusive tolerance 0.01.",
        "score": 1,
        "status": "scored",
        "weight": 0.35
      },
      {
        "criterion_id": "c_image_character",
        "evidence": "The image at 2f is real and inverted.",
        "score": 1,
        "status": "scored",
        "weight": 0.25
      }
    ],
    "evaluator_fingerprint": "e9a66e11f05c50548fd9e335fa914224df631d01e427cae2f5dede057460b279",
    "evaluator_version": "0.2.0",
    "failure_mode": "invalid_contract",
    "judge_results": [],
    "protocol": "case_assisted",
    "provider_usage": {
      "turns": [
        {
          "source": "codex_jsonl",
          "usage": {
            "cached_input": 0,
            "input": 12766,
            "output": 216,
            "reasoning": 110
          }
        }
      ]
    },
    "raw_answer": "{\n  \"answers\": {\n    \"q1\": {\n      \"image_distance_in_focal_lengths\": {\n        \"value\": 2,\n        \"unit\": \"f\"\n      }\n    },\n    \"q2\": {\n      \"lateral_magnification\": {\n        \"value\": -1,\n        \"unit\": \"1\"\n      }\n    },\n    \"q3\": {\n      \"image_type\": \"real\",\n      \"orientation\": \"inverted\"\n    }\n  }\n}",
    "result_schema_version": "0.1.0",
    "retry_count": 0,
    "run_id": "2026-09-28-openai-gpt-6-luna-020rc1-formal",
    "scores": {
      "capped_total": 0.6,
      "raw_total": 0.6
    },
    "structured_answer": {
      "answers": {
        "q1": {
          "image_distance_in_focal_lengths": {
            "unit": "f",
            "value": 2
          }
        },
        "q2": {
          "lateral_magnification": {
            "unit": "1",
            "value": -1
          }
        },
        "q3": {
          "image_type": "real",
          "orientation": "inverted"
        }
      }
    },
    "system": {
      "model_id": "gpt-6-luna",
      "model_version": null,
      "name": "codex-cli-0.158.0",
      "provider": "openai",
      "scaffold_id": "neutral_optics_v1"
    },
    "tokens": {
      "cached_input": 0,
      "input": 12766,
      "output": 216,
      "total": 12982
    },
    "tool_call_count": 0,
    "tools_available": [],
    "tools_used": [],
    "validator_results": [
      {
        "check_id": "n_image_distance",
        "details": {
          "answer_path": "answers.q1.image_distance_in_focal_lengths",
          "failure_class": "wrong_unit"
        },
        "evidence": "unsupported unit: 'f'",
        "score": 0,
        "status": "fail",
        "version": "0.2.0"
      },
      {
        "check_id": "n_magnification",
        "details": {
          "answer_path": "answers.q2.lateral_magnification",
          "candidate_si": -1.0,
          "comparator": "max_abs_or_relative_inclusive",
          "difference_si": 0.0,
          "dimension": "dimensionless",
          "magnitude_convention": false,
          "tolerance_si": 0.01,
          "validator_id": "thin_lens_magnification"
        },
        "evidence": "Absolute SI error 0 <= inclusive tolerance 0.01.",
        "score": 1,
        "status": "pass",
        "version": "0.2.0"
      },
      {
        "check_id": "c_image_character",
        "details": {},
        "evidence": "The image at 2f is real and inverted.",
        "score": 1,
        "status": "pass",
        "version": "0.2.0"
      }
    ],
    "wall_time_seconds": 14.360000000044238
  },
  "selection": {
    "case_content_sha256": "ede169b7b694734d54d7502f5cb8c08a58aa26c0cb5f46167ae01e50186e25ea",
    "case_id": "SEED-3-1",
    "case_revision": "0.3.0",
    "track": "verified",
    "variant_id": null,
    "variant_type": null
  },
  "status": "completed",
  "tool_calls": [],
  "tool_observation_scope": "complete_with_builtin_tools_disabled",
  "usage": {
    "cached_input": 0,
    "input": 12766,
    "output": 216,
    "reasoning": 110,
    "total": 12982
  },
  "wall_time_seconds": 14.438000000023749
}
