{
  "agent_identity": {
    "adapter_type": "codex_cli",
    "framework": "codex-cli-0.158.0",
    "model_id": "gpt-6-sol",
    "model_version": null,
    "provider": "openai",
    "scaffold_id": "neutral_optics_v1",
    "system_prompt_version": "neutral_optics_v1"
  },
  "attempt_count": 1,
  "cost": null,
  "execution_class": "real",
  "failure_class": null,
  "first_attempt_success": true,
  "model_turn_count": 1,
  "parsed_answer": {
    "answers": {
      "q1": {
        "image_distance_in_focal_lengths": {
          "unit": "1",
          "value": 2
        }
      },
      "q2": {
        "lateral_magnification": {
          "unit": "1",
          "value": -1
        }
      },
      "q3": {
        "image_type": "real",
        "orientation": "inverted"
      }
    },
    "explanation": "The thin-lens equation gives an image distance of 2f behind the lens. The signed magnification is −(2f)/(2f) = −1."
  },
  "protocol": {
    "id": "tool_assisted",
    "scientific_payload_sha256": "c6594b75be6d42473fb95d83357fd89fc6b02cf71ceaf6ce153a0192477ee7eb",
    "version": "1.0.0"
  },
  "protocol_compliance_verified": true,
  "raw_response": "{\"answers\":{\"q1\":{\"image_distance_in_focal_lengths\":{\"value\":2,\"unit\":\"1\"}},\"q2\":{\"lateral_magnification\":{\"value\":-1,\"unit\":\"1\"}},\"q3\":{\"image_type\":\"real\",\"orientation\":\"inverted\"}},\"explanation\":\"The thin-lens equation gives an image distance of 2f behind the lens. The signed magnification is −(2f)/(2f) = −1.\"}",
  "retrieval": null,
  "retry_count": 0,
  "run_id": "2026-09-28-openai-gpt-6-sol-020rc1-formal",
  "run_record_version": "0.1.0",
  "runner_source_revision": "caebd4bbb908a6a2e9b375b0de5f3ccec759a57d+source-sha256:7ef29715ea6a705dc9ca41d4760b9953cf899b5d97a06ab92297d61926931cba",
  "score_result": {
    "benchmark_version": "0.2.0-rc1",
    "case_content_sha256": "ede169b7b694734d54d7502f5cb8c08a58aa26c0cb5f46167ae01e50186e25ea",
    "case_id": "SEED-3-1",
    "case_library_access": {
      "available": false,
      "retrieved_document_ids": [],
      "snapshot_id": null
    },
    "case_revision": "0.3.0",
    "cost": null,
    "criterion_scores": [
      {
        "criterion_id": "n_image_distance",
        "evidence": "Absolute SI error 0 <= inclusive tolerance 0.01.",
        "score": 1,
        "status": "scored",
        "weight": 0.4
      },
      {
        "criterion_id": "n_magnification",
        "evidence": "Absolute SI error 0 <= inclusive tolerance 0.01.",
        "score": 1,
        "status": "scored",
        "weight": 0.35
      },
      {
        "criterion_id": "c_image_character",
        "evidence": "The image at 2f is real and inverted.",
        "score": 1,
        "status": "scored",
        "weight": 0.25
      }
    ],
    "evaluator_fingerprint": "e9a66e11f05c50548fd9e335fa914224df631d01e427cae2f5dede057460b279",
    "evaluator_version": "0.2.0",
    "failure_mode": "none",
    "judge_results": [],
    "protocol": "tool_assisted",
    "provider_usage": {
      "turns": [
        {
          "source": "codex_jsonl",
          "usage": {
            "cached_input": 11776,
            "input": 12625,
            "output": 308,
            "reasoning": 209
          }
        }
      ]
    },
    "raw_answer": "{\"answers\":{\"q1\":{\"image_distance_in_focal_lengths\":{\"value\":2,\"unit\":\"1\"}},\"q2\":{\"lateral_magnification\":{\"value\":-1,\"unit\":\"1\"}},\"q3\":{\"image_type\":\"real\",\"orientation\":\"inverted\"}},\"explanation\":\"The thin-lens equation gives an image distance of 2f behind the lens. The signed magnification is −(2f)/(2f) = −1.\"}",
    "result_schema_version": "0.1.0",
    "retry_count": 0,
    "run_id": "2026-09-28-openai-gpt-6-sol-020rc1-formal",
    "scores": {
      "capped_total": 1.0,
      "raw_total": 1.0
    },
    "structured_answer": {
      "answers": {
        "q1": {
          "image_distance_in_focal_lengths": {
            "unit": "1",
            "value": 2
          }
        },
        "q2": {
          "lateral_magnification": {
            "unit": "1",
            "value": -1
          }
        },
        "q3": {
          "image_type": "real",
          "orientation": "inverted"
        }
      },
      "explanation": "The thin-lens equation gives an image distance of 2f behind the lens. The signed magnification is −(2f)/(2f) = −1."
    },
    "system": {
      "model_id": "gpt-6-sol",
      "model_version": null,
      "name": "codex-cli-0.158.0",
      "provider": "openai",
      "scaffold_id": "neutral_optics_v1"
    },
    "tokens": {
      "cached_input": 11776,
      "input": 12625,
      "output": 308,
      "total": 12933
    },
    "tool_call_count": 0,
    "tools_available": [
      "calculator",
      "unit_convert"
    ],
    "tools_used": [],
    "validator_results": [
      {
        "check_id": "n_image_distance",
        "details": {
          "answer_path": "answers.q1.image_distance_in_focal_lengths",
          "candidate_si": 2.0,
          "comparator": "max_abs_or_relative_inclusive",
          "difference_si": 0.0,
          "dimension": "dimensionless",
          "magnitude_convention": false,
          "tolerance_si": 0.01,
          "validator_id": "thin_lens_image_distance_ratio"
        },
        "evidence": "Absolute SI error 0 <= inclusive tolerance 0.01.",
        "score": 1,
        "status": "pass",
        "version": "0.2.0"
      },
      {
        "check_id": "n_magnification",
        "details": {
          "answer_path": "answers.q2.lateral_magnification",
          "candidate_si": -1.0,
          "comparator": "max_abs_or_relative_inclusive",
          "difference_si": 0.0,
          "dimension": "dimensionless",
          "magnitude_convention": false,
          "tolerance_si": 0.01,
          "validator_id": "thin_lens_magnification"
        },
        "evidence": "Absolute SI error 0 <= inclusive tolerance 0.01.",
        "score": 1,
        "status": "pass",
        "version": "0.2.0"
      },
      {
        "check_id": "c_image_character",
        "details": {},
        "evidence": "The image at 2f is real and inverted.",
        "score": 1,
        "status": "pass",
        "version": "0.2.0"
      }
    ],
    "wall_time_seconds": 20.75
  },
  "selection": {
    "case_content_sha256": "ede169b7b694734d54d7502f5cb8c08a58aa26c0cb5f46167ae01e50186e25ea",
    "case_id": "SEED-3-1",
    "case_revision": "0.3.0",
    "track": "verified",
    "variant_id": null,
    "variant_type": null
  },
  "status": "completed",
  "tool_calls": [],
  "tool_observation_scope": "complete_with_builtin_tools_disabled",
  "usage": {
    "cached_input": 11776,
    "input": 12625,
    "output": 308,
    "reasoning": 209,
    "total": 12933
  },
  "wall_time_seconds": 20.81299999996554
}
