{
  "agent_identity": {
    "adapter_type": "codex_cli",
    "framework": "codex-cli-0.158.0",
    "model_id": "gpt-6-luna",
    "model_version": null,
    "provider": "openai",
    "scaffold_id": "neutral_optics_v1",
    "system_prompt_version": "neutral_optics_v1"
  },
  "attempt_count": 1,
  "cost": null,
  "execution_class": "real",
  "failure_class": null,
  "first_attempt_success": true,
  "model_turn_count": 1,
  "parsed_answer": {
    "answers": {
      "q1": {
        "expansion_factor": {
          "unit": "dimensionless",
          "value": 5
        }
      },
      "q2": {
        "galilean": {
          "input_focal_length": {
            "unit": "mm",
            "value": -25
          },
          "lens_order": "negative lens, then positive lens",
          "output_focal_length": {
            "unit": "mm",
            "value": 125
          }
        },
        "keplerian": {
          "input_focal_length": {
            "unit": "mm",
            "value": 25
          },
          "lens_order": "positive lens, then positive lens",
          "output_focal_length": {
            "unit": "mm",
            "value": 125
          }
        }
      },
      "q3": {
        "galilean_real_internal_focus": false,
        "keplerian_real_internal_focus": true
      }
    },
    "explanation": "The required diameter expansion is 7.5/1.5 = 5, so the magnitude of the output-to-input focal-length ratio is 5. For the stated propagation direction, the Keplerian pair forms a real focus between the lenses; the Galilean pair does not."
  },
  "protocol": {
    "id": "closed_book",
    "scientific_payload_sha256": "4155419e219660e702abf6470fa7b7ccb25c2265fd2f32b21d53e29a2444785b",
    "version": "1.0.0"
  },
  "protocol_compliance_verified": true,
  "raw_response": "{\n  \"answers\": {\n    \"q1\": {\n      \"expansion_factor\": {\n        \"value\": 5,\n        \"unit\": \"dimensionless\"\n      }\n    },\n    \"q2\": {\n      \"keplerian\": {\n        \"input_focal_length\": {\n          \"value\": 25,\n          \"unit\": \"mm\"\n        },\n        \"output_focal_length\": {\n          \"value\": 125,\n          \"unit\": \"mm\"\n        },\n        \"lens_order\": \"positive lens, then positive lens\"\n      },\n      \"galilean\": {\n        \"input_focal_length\": {\n          \"value\": -25,\n          \"unit\": \"mm\"\n        },\n        \"output_focal_length\": {\n          \"value\": 125,\n          \"unit\": \"mm\"\n        },\n        \"lens_order\": \"negative lens, then positive lens\"\n      }\n    },\n    \"q3\": {\n      \"keplerian_real_internal_focus\": true,\n      \"galilean_real_internal_focus\": false\n    }\n  },\n  \"explanation\": \"The required diameter expansion is 7.5/1.5 = 5, so the magnitude of the output-to-input focal-length ratio is 5. For the stated propagation direction, the Keplerian pair forms a real focus between the lenses; the Galilean pair does not.\"\n}",
  "retrieval": null,
  "retry_count": 0,
  "run_id": "2026-09-28-openai-gpt-6-luna-020rc1-formal",
  "run_record_version": "0.1.0",
  "runner_source_revision": "caebd4bbb908a6a2e9b375b0de5f3ccec759a57d+source-sha256:7ef29715ea6a705dc9ca41d4760b9953cf899b5d97a06ab92297d61926931cba",
  "score_result": {
    "benchmark_version": "0.2.0-rc1",
    "case_content_sha256": "dfe041664ee0fc501e683ad4ecadfedb5ab7294d9f4b0bb137fd76b40494cbc6",
    "case_id": "SEED-2-2",
    "case_library_access": {
      "available": false,
      "retrieved_document_ids": [],
      "snapshot_id": null
    },
    "case_revision": "0.2.2",
    "cost": null,
    "criterion_scores": [
      {
        "criterion_id": "n_expansion",
        "evidence": "Absolute SI error 0 <= inclusive tolerance 0.1.",
        "score": 1,
        "status": "scored",
        "weight": 0.35
      },
      {
        "criterion_id": "c_examples",
        "evidence": "Keplerian: Lens signs, order, and focal-length magnitude ratio yield the requested afocal expansion. Galilean: Lens signs, order, and focal-length magnitude ratio yield the requested afocal expansion.",
        "score": 1,
        "status": "scored",
        "weight": 0.4
      },
      {
        "criterion_id": "c_focus",
        "evidence": "Internal real-focus distinction for the stated lens order.",
        "score": 1,
        "status": "scored",
        "weight": 0.25
      }
    ],
    "evaluator_fingerprint": "22781ef61e11c35d873eadef406e3eb2c01262b3fe3756451959544178224c7b",
    "evaluator_version": "0.2.0",
    "failure_mode": "none",
    "judge_results": [],
    "protocol": "closed_book",
    "provider_usage": {
      "turns": [
        {
          "source": "codex_jsonl",
          "usage": {
            "cached_input": 11008,
            "input": 12598,
            "output": 781,
            "reasoning": 494
          }
        }
      ]
    },
    "raw_answer": "{\n  \"answers\": {\n    \"q1\": {\n      \"expansion_factor\": {\n        \"value\": 5,\n        \"unit\": \"dimensionless\"\n      }\n    },\n    \"q2\": {\n      \"keplerian\": {\n        \"input_focal_length\": {\n          \"value\": 25,\n          \"unit\": \"mm\"\n        },\n        \"output_focal_length\": {\n          \"value\": 125,\n          \"unit\": \"mm\"\n        },\n        \"lens_order\": \"positive lens, then positive lens\"\n      },\n      \"galilean\": {\n        \"input_focal_length\": {\n          \"value\": -25,\n          \"unit\": \"mm\"\n        },\n        \"output_focal_length\": {\n          \"value\": 125,\n          \"unit\": \"mm\"\n        },\n        \"lens_order\": \"negative lens, then positive lens\"\n      }\n    },\n    \"q3\": {\n      \"keplerian_real_internal_focus\": true,\n      \"galilean_real_internal_focus\": false\n    }\n  },\n  \"explanation\": \"The required diameter expansion is 7.5/1.5 = 5, so the magnitude of the output-to-input focal-length ratio is 5. For the stated propagation direction, the Keplerian pair forms a real focus between the lenses; the Galilean pair does not.\"\n}",
    "result_schema_version": "0.1.0",
    "retry_count": 0,
    "run_id": "2026-09-28-openai-gpt-6-luna-020rc1-formal",
    "scores": {
      "capped_total": 1.0,
      "raw_total": 1.0
    },
    "structured_answer": {
      "answers": {
        "q1": {
          "expansion_factor": {
            "unit": "dimensionless",
            "value": 5
          }
        },
        "q2": {
          "galilean": {
            "input_focal_length": {
              "unit": "mm",
              "value": -25
            },
            "lens_order": "negative lens, then positive lens",
            "output_focal_length": {
              "unit": "mm",
              "value": 125
            }
          },
          "keplerian": {
            "input_focal_length": {
              "unit": "mm",
              "value": 25
            },
            "lens_order": "positive lens, then positive lens",
            "output_focal_length": {
              "unit": "mm",
              "value": 125
            }
          }
        },
        "q3": {
          "galilean_real_internal_focus": false,
          "keplerian_real_internal_focus": true
        }
      },
      "explanation": "The required diameter expansion is 7.5/1.5 = 5, so the magnitude of the output-to-input focal-length ratio is 5. For the stated propagation direction, the Keplerian pair forms a real focus between the lenses; the Galilean pair does not."
    },
    "system": {
      "model_id": "gpt-6-luna",
      "model_version": null,
      "name": "codex-cli-0.158.0",
      "provider": "openai",
      "scaffold_id": "neutral_optics_v1"
    },
    "tokens": {
      "cached_input": 11008,
      "input": 12598,
      "output": 781,
      "total": 13379
    },
    "tool_call_count": 0,
    "tools_available": [],
    "tools_used": [],
    "validator_results": [
      {
        "check_id": "n_expansion",
        "details": {
          "answer_path": "answers.q1.expansion_factor",
          "candidate_si": 5.0,
          "comparator": "absolute_inclusive",
          "difference_si": 0.0,
          "dimension": "dimensionless",
          "magnitude_convention": false,
          "tolerance_si": 0.1,
          "validator_id": "afocal_expansion"
        },
        "evidence": "Absolute SI error 0 <= inclusive tolerance 0.1.",
        "score": 1,
        "status": "pass",
        "version": "0.2.0"
      },
      {
        "check_id": "c_examples",
        "details": {},
        "evidence": "Keplerian: Lens signs, order, and focal-length magnitude ratio yield the requested afocal expansion. Galilean: Lens signs, order, and focal-length magnitude ratio yield the requested afocal expansion.",
        "score": 1,
        "status": "pass",
        "version": "0.2.0"
      },
      {
        "check_id": "c_focus",
        "details": {},
        "evidence": "Internal real-focus distinction for the stated lens order.",
        "score": 1,
        "status": "pass",
        "version": "0.2.0"
      }
    ],
    "wall_time_seconds": 31.26600000000326
  },
  "selection": {
    "case_content_sha256": "dfe041664ee0fc501e683ad4ecadfedb5ab7294d9f4b0bb137fd76b40494cbc6",
    "case_id": "SEED-2-2",
    "case_revision": "0.2.2",
    "track": "verified",
    "variant_id": null,
    "variant_type": null
  },
  "status": "completed",
  "tool_calls": [],
  "tool_observation_scope": "complete_with_builtin_tools_disabled",
  "usage": {
    "cached_input": 11008,
    "input": 12598,
    "output": 781,
    "reasoning": 494,
    "total": 13379
  },
  "wall_time_seconds": 31.32799999997951
}
