{
  "agent_identity": {
    "adapter_type": "codex_cli",
    "framework": "codex-cli-0.158.0",
    "model_id": "gpt-6-luna",
    "model_version": null,
    "provider": "openai",
    "scaffold_id": "neutral_optics_v1",
    "system_prompt_version": "neutral_optics_v1"
  },
  "attempt_count": 1,
  "cost": null,
  "execution_class": "real",
  "failure_class": null,
  "first_attempt_success": true,
  "model_turn_count": 1,
  "parsed_answer": {
    "answers": {
      "q1": {
        "path_change": {
          "unit": "mm",
          "value": 2.0
        }
      },
      "q2": {
        "delay_change": {
          "unit": "ps",
          "value": 6.67
        }
      },
      "q3": {
        "stage_travel": {
          "unit": "mm",
          "value": 14.99
        }
      }
    },
    "explanation": "The round-trip optical path changes by twice the 1.00 mm stage displacement. Using the speed of light, 2 mm corresponds to about 6.67 ps; a 100 ps scan therefore requires about 14.99 mm of one-way stage travel."
  },
  "protocol": {
    "id": "tool_assisted",
    "scientific_payload_sha256": "7f2bef184e0dbe04441745ff0297d6ac0cb604849f1795ea91b620f10a605d4e",
    "version": "1.0.0"
  },
  "protocol_compliance_verified": true,
  "raw_response": "{\"answers\":{\"q1\":{\"path_change\":{\"value\":2.0,\"unit\":\"mm\"}},\"q2\":{\"delay_change\":{\"value\":6.67,\"unit\":\"ps\"}},\"q3\":{\"stage_travel\":{\"value\":14.99,\"unit\":\"mm\"}}},\"explanation\":\"The round-trip optical path changes by twice the 1.00 mm stage displacement. Using the speed of light, 2 mm corresponds to about 6.67 ps; a 100 ps scan therefore requires about 14.99 mm of one-way stage travel.\"}",
  "retrieval": null,
  "retry_count": 0,
  "run_id": "2026-09-28-openai-gpt-6-luna-020rc1-formal",
  "run_record_version": "0.1.0",
  "runner_source_revision": "caebd4bbb908a6a2e9b375b0de5f3ccec759a57d+source-sha256:7ef29715ea6a705dc9ca41d4760b9953cf899b5d97a06ab92297d61926931cba",
  "score_result": {
    "benchmark_version": "0.2.0-rc1",
    "case_content_sha256": "1877546a59b9ca61ee9278cc9fa28d8eb38b13deeaacbff86c033af3f864c717",
    "case_id": "SEED-1-5",
    "case_library_access": {
      "available": false,
      "retrieved_document_ids": [],
      "snapshot_id": null
    },
    "case_revision": "0.1.5",
    "cost": null,
    "criterion_scores": [
      {
        "criterion_id": "n_path",
        "evidence": "Absolute SI error 0 <= inclusive tolerance 3e-05.",
        "score": 1,
        "status": "scored",
        "weight": 0.3
      },
      {
        "criterion_id": "n_delay",
        "evidence": "Absolute SI error 1.28190396304e-15 <= inclusive tolerance 1.2e-13.",
        "score": 1,
        "status": "scored",
        "weight": 0.35
      },
      {
        "criterion_id": "n_travel",
        "evidence": "Absolute SI error 3.77099999999e-07 <= inclusive tolerance 0.0004.",
        "score": 1,
        "status": "scored",
        "weight": 0.35
      }
    ],
    "evaluator_fingerprint": "22781ef61e11c35d873eadef406e3eb2c01262b3fe3756451959544178224c7b",
    "evaluator_version": "0.2.0",
    "failure_mode": "none",
    "judge_results": [],
    "protocol": "tool_assisted",
    "provider_usage": {
      "turns": [
        {
          "source": "codex_jsonl",
          "usage": {
            "cached_input": 0,
            "input": 12569,
            "output": 234,
            "reasoning": 115
          }
        }
      ]
    },
    "raw_answer": "{\"answers\":{\"q1\":{\"path_change\":{\"value\":2.0,\"unit\":\"mm\"}},\"q2\":{\"delay_change\":{\"value\":6.67,\"unit\":\"ps\"}},\"q3\":{\"stage_travel\":{\"value\":14.99,\"unit\":\"mm\"}}},\"explanation\":\"The round-trip optical path changes by twice the 1.00 mm stage displacement. Using the speed of light, 2 mm corresponds to about 6.67 ps; a 100 ps scan therefore requires about 14.99 mm of one-way stage travel.\"}",
    "result_schema_version": "0.1.0",
    "retry_count": 0,
    "run_id": "2026-09-28-openai-gpt-6-luna-020rc1-formal",
    "scores": {
      "capped_total": 1.0,
      "raw_total": 1.0
    },
    "structured_answer": {
      "answers": {
        "q1": {
          "path_change": {
            "unit": "mm",
            "value": 2.0
          }
        },
        "q2": {
          "delay_change": {
            "unit": "ps",
            "value": 6.67
          }
        },
        "q3": {
          "stage_travel": {
            "unit": "mm",
            "value": 14.99
          }
        }
      },
      "explanation": "The round-trip optical path changes by twice the 1.00 mm stage displacement. Using the speed of light, 2 mm corresponds to about 6.67 ps; a 100 ps scan therefore requires about 14.99 mm of one-way stage travel."
    },
    "system": {
      "model_id": "gpt-6-luna",
      "model_version": null,
      "name": "codex-cli-0.158.0",
      "provider": "openai",
      "scaffold_id": "neutral_optics_v1"
    },
    "tokens": {
      "cached_input": 0,
      "input": 12569,
      "output": 234,
      "total": 12803
    },
    "tool_call_count": 0,
    "tools_available": [
      "calculator",
      "unit_convert"
    ],
    "tools_used": [],
    "validator_results": [
      {
        "check_id": "n_path",
        "details": {
          "answer_path": "answers.q1.path_change",
          "candidate_si": 0.002,
          "comparator": "max_abs_or_relative_inclusive",
          "difference_si": 0.0,
          "dimension": "length",
          "magnitude_convention": true,
          "tolerance_si": 3e-05,
          "validator_id": "folded_delay_path"
        },
        "evidence": "Absolute SI error 0 <= inclusive tolerance 3e-05.",
        "score": 1,
        "status": "pass",
        "version": "0.2.0"
      },
      {
        "check_id": "n_delay",
        "details": {
          "answer_path": "answers.q2.delay_change",
          "candidate_si": 6.67e-12,
          "comparator": "max_abs_or_relative_inclusive",
          "difference_si": -1.2819039630417592e-15,
          "dimension": "time",
          "magnitude_convention": true,
          "tolerance_si": 1.2e-13,
          "validator_id": "folded_delay_time"
        },
        "evidence": "Absolute SI error 1.28190396304e-15 <= inclusive tolerance 1.2e-13.",
        "score": 1,
        "status": "pass",
        "version": "0.2.0"
      },
      {
        "check_id": "n_travel",
        "details": {
          "answer_path": "answers.q3.stage_travel",
          "candidate_si": 0.01499,
          "comparator": "max_abs_or_relative_inclusive",
          "difference_si": 3.7709999999892274e-07,
          "dimension": "length",
          "magnitude_convention": false,
          "tolerance_si": 0.0004,
          "validator_id": "folded_delay_stage_for_target"
        },
        "evidence": "Absolute SI error 3.77099999999e-07 <= inclusive tolerance 0.0004.",
        "score": 1,
        "status": "pass",
        "version": "0.2.0"
      }
    ],
    "wall_time_seconds": 16.65600000001723
  },
  "selection": {
    "case_content_sha256": "1877546a59b9ca61ee9278cc9fa28d8eb38b13deeaacbff86c033af3f864c717",
    "case_id": "SEED-1-5",
    "case_revision": "0.1.5",
    "track": "verified",
    "variant_id": null,
    "variant_type": null
  },
  "status": "completed",
  "tool_calls": [],
  "tool_observation_scope": "complete_with_builtin_tools_disabled",
  "usage": {
    "cached_input": 0,
    "input": 12569,
    "output": 234,
    "reasoning": 115,
    "total": 12803
  },
  "wall_time_seconds": 16.75
}
